[
  {
    "mechanismId": "mech-rhetorical-reframing",
    "caseId": "institutional-sacrificial-escalation",
    "name": "Rhetorical reframing of death as obligation",
    "mechanismClass": "symbolic",
    "description": "Prior death is interpreted as imposing a duty to complete the collective task.",
    "observableIndicators": [
      "death linked to unfinished purpose",
      "withdrawal framed as betrayal of the dead"
    ],
    "boundaryConditions": [
      "requires an audience sharing the relevant collective identity"
    ]
  },
  {
    "mechanismId": "mech-sunk-cost",
    "caseId": "institutional-sacrificial-escalation",
    "name": "Sunk-cost and commitment escalation",
    "mechanismClass": "psychological",
    "description": "Prior cost increases pressure to continue rather than admit loss or change course.",
    "observableIndicators": [
      "past losses used as reasons for future expenditure",
      "reversal described as invalidating prior sacrifice"
    ],
    "boundaryConditions": [
      "does not establish conscious intention or spiritual agency by itself"
    ]
  },
  {
    "mechanismId": "mech-institutional-continuity",
    "caseId": "institutional-sacrificial-escalation",
    "name": "Institutional continuity pressure",
    "mechanismClass": "institutional",
    "description": "Offices, procedures, commitments, and organizational identity constrain available choices.",
    "observableIndicators": [
      "policy persistence across personnel",
      "procedural reproduction of commitment"
    ],
    "boundaryConditions": [
      "must be demonstrated through institutional records"
    ]
  },
  {
    "mechanismId": "mech-ritual-memory",
    "caseId": "institutional-sacrificial-escalation",
    "name": "Ritualized memory reinforcement",
    "mechanismClass": "ritual",
    "description": "Ceremony and commemoration bind collective identity to interpretations of prior deaths.",
    "observableIndicators": [
      "anniversary repetition",
      "sacred-ground language",
      "commemorative formulas"
    ],
    "boundaryConditions": [
      "ritual repetition may preserve competing meanings"
    ]
  },
  {
    "mechanismId": "mech-spiritual-deception-proposed",
    "caseId": "institutional-sacrificial-escalation",
    "name": "Proposed spiritual deception and domination",
    "mechanismClass": "spiritual-proposed",
    "description": "A theological proposal that a hostile intelligence amplifies false ultimacy, domination, and sacrificial demand.",
    "observableIndicators": [
      "must be specified by tradition rather than inferred from evil alone"
    ],
    "boundaryConditions": [
      "requires lower-level assessment and independent argument"
    ]
  }
]
